{
  "componentName": "TimePicker",
  "figmaCommunityId": "sap-web-ui-kit",
  "figmaComponentId": "f07044ee64f4abfc857543051806986d49a54b68",
  "figmaLibraryFileId": "p7zm5EMBk5DRRZdxNeJ4f5",
  "componentCategory": "Input",
  "supportedVariants": [
    {
      "property": "Form Factor",
      "values": [
        "Compact",
        "Cozy"
      ],
      "default": "Compact"
    },
    {
      "property": "Interaction State",
      "values": [
        "Regular",
        "Hover",
        "Focused",
        "Disabled",
        "ReadOnly"
      ],
      "default": "Regular"
    }
  ],
  "supportedProperties": [
    {
      "name": "placeholder",
      "ui5Name": "placeholder",
      "type": "text",
      "exposedInLibrary": true,
      "default": ""
    },
    {
      "name": "value",
      "ui5Name": "value",
      "type": "text",
      "exposedInLibrary": true,
      "default": ""
    }
  ],
  "supportedStates": [
    "Regular",
    "Hover",
    "Focused",
    "Disabled",
    "ReadOnly",
    "Error",
    "Warning",
    "Success"
  ],
  "typographyRules": [
    {
      "role": "value",
      "fontFamily": "72",
      "fontStyle": "Regular",
      "fontSize": 14,
      "sapStyleName": "MediumText/LHAuto/Regular"
    }
  ],
  "colorTokenRules": [
    {
      "role": "background",
      "token": "sapBackgroundColor",
      "fallbackHex": "#FFFFFF"
    },
    {
      "role": "border",
      "token": "sapField_BorderColor",
      "fallbackHex": "#556B81"
    },
    {
      "role": "text",
      "token": "sapList_TextColor",
      "fallbackHex": "#1D2D3E"
    }
  ],
  "accessibilityRules": [
    {
      "category": "keyboard",
      "requirement": "Arrow keys adjust hours/minutes; Tab moves between fields"
    },
    {
      "category": "labeling",
      "requirement": "Pair with Label"
    }
  ],
  "doRules": [
    "Use when only time-of-day is needed",
    "Match locale 12/24 hour format"
  ],
  "dontRules": [
    "Do not use for date+time \u2014 use DateTimePicker"
  ],
  "compatibleComponents": [
    "Label",
    "Form"
  ],
  "incompatiblePatterns": [
    "Without Label"
  ],
  "guidelineUrl": "https://experience.sap.com/fiori-design-web/timepicker/",
  "demoKitUrl": "https://sapui5.hana.ondemand.com/#/entity/sap.m.TimePicker",
  "apiUrl": "https://sapui5.hana.ondemand.com/#/api/sap.m.TimePicker",
  "sampleUrls": [],
  "libraryVersion": "1.149.0",
  "lastValidated": "2026-06-27",
  "pluginNotes": {
    "textInjectionMethod": "setProperties",
    "sizingConstraints": "160px default.",
    "knownIssues": []
  },
  "composition": {
    "validParents": [
      "Form",
      "SimpleForm",
      "FormContainer",
      "FormElement",
      "Panel",
      "Dialog",
      "Popover",
      "FilterBar",
      "SapFormSection",
      "IconTabBar",
      "ObjectPageSection",
      "SapTableRow",
      "ColumnListItem",
      "InputListItem"
    ],
    "topLevelOnly": false,
    "validChildren": [],
    "mustInclude": [],
    "mustExclude": [],
    "commonSiblings": [
      "Label",
      "DatePicker"
    ]
  }
}
