{
  "componentName": "DropDown",
  "figmaCommunityId": "sap-web-ui-kit",
  "figmaComponentId": "d74d4ae8eb549d3cc54b7d345e3b17f90c543817",
  "figmaLibraryFileId": "p7zm5EMBk5DRRZdxNeJ4f5",
  "componentCategory": "Input",
  "supportedVariants": [
    {
      "property": "Form Factor",
      "values": [
        "Compact",
        "Cozy"
      ],
      "default": "Compact"
    }
  ],
  "supportedProperties": [
    {
      "name": "selectedKey",
      "ui5Name": "selectedKey",
      "type": "text",
      "exposedInLibrary": true,
      "default": ""
    },
    {
      "name": "placeholder",
      "ui5Name": "placeholder",
      "type": "text",
      "exposedInLibrary": true,
      "default": ""
    },
    {
      "name": "enabled",
      "ui5Name": "enabled",
      "type": "boolean",
      "exposedInLibrary": true,
      "default": true
    }
  ],
  "supportedStates": [
    "Regular"
  ],
  "typographyRules": [
    {
      "role": "selected-value",
      "fontFamily": "72",
      "fontStyle": "Regular",
      "fontSize": 14,
      "sapStyleName": "MediumText/LHAuto/Regular"
    },
    {
      "role": "placeholder",
      "fontFamily": "72",
      "fontStyle": "Regular",
      "fontSize": 14,
      "sapStyleName": "MediumText/LHAuto/Regular"
    }
  ],
  "colorTokenRules": [
    {
      "role": "background",
      "token": "sapField_Background",
      "fallbackHex": "#FFFFFF"
    },
    {
      "role": "border",
      "token": "sapField_BorderColor",
      "fallbackHex": "#556B81"
    },
    {
      "role": "text",
      "token": "sapField_TextColor",
      "fallbackHex": "#1A2733"
    },
    {
      "role": "placeholder",
      "token": "sapField_PlaceholderTextColor",
      "fallbackHex": "#556B82"
    }
  ],
  "accessibilityRules": [
    {
      "category": "labeling",
      "requirement": "Provide accessible name matching the visible label or purpose"
    },
    {
      "category": "keyboard",
      "requirement": "All interactive elements reachable via Tab and operable via Enter/Space"
    }
  ],
  "doRules": [
    "Use DropDown as documented in SAP Fiori Design Guidelines (https://experience.sap.com/fiori-design-web/select/)"
  ],
  "dontRules": [
    "Do not use DropDown outside its documented placements — see composition.validParents"
  ],
  "compatibleComponents": [
    "Label",
    "Input",
    "Select",
    "MultiComboBox"
  ],
  "incompatiblePatterns": [],
  "guidelineUrl": "https://experience.sap.com/fiori-design-web/select/",
  "demoKitUrl": "",
  "apiUrl": "",
  "sampleUrls": [],
  "libraryVersion": "1.149.0",
  "lastValidated": "2026-07-08",
  "pluginNotes": {
    "textInjectionMethod": "setProperties",
    "sizingConstraints": "See SAP kit 'Drop-Down' component for native dimensions",
    "knownIssues": []
  },
  "composition": {
    "validParents": [
      "Form",
      "SimpleForm",
      "FormContainer",
      "FormElement",
      "FilterBar",
      "Toolbar",
      "OverflowToolbar",
      "Panel",
      "Card",
      "Dialog",
      "Popover",
      "SapFormSection",
      "Bar"
    ],
    "topLevelOnly": false,
    "validChildren": [],
    "mustInclude": [],
    "mustExclude": [],
    "commonSiblings": [
      "Label",
      "Input",
      "Select",
      "MultiComboBox"
    ]
  }
}
